{
  "comparison": {
    "blinding_seed": 107051797238930,
    "left": "transcript-summary-ollama-qwen3-4b-high-summarizer-r1",
    "presented_order": [
      "left",
      "right"
    ],
    "right": "transcript-summary-ollama-nemotron-3-nano-4b-high-summarizer-r1"
  },
  "invalid": true,
  "judge": {
    "id": "judge-nemotron",
    "model": "ollama/nemotron-3-nano:4b",
    "rubric_version": "1",
    "thinking": "off"
  },
  "metrics": {
    "concision": "tie",
    "coverage": "tie",
    "fidelity": "tie"
  },
  "overall_preference": "tie",
  "rationale": null,
  "raw_output_ref": "judgments/judge-nemotron/transcript-summary-ollama-qwen3-4b-high-summarizer-r1__transcript-summary-ollama-nemotron-3-nano-4b-high-summarizer-r1.artifacts",
  "recorded_at": "2026-08-04T16:34:44Z",
  "schema_version": 2,
  "type": "judge_verdict"
}
