{
  "comparison": {
    "blinding_seed": 78140930120785,
    "left": "transcript-summary-ollama-nemotron-3-nano-4b-high-summarizer-r1",
    "presented_order": [
      "right",
      "left"
    ],
    "right": "transcript-summary-claude-cli-haiku-high-summarizer-r1"
  },
  "invalid": false,
  "judge": {
    "id": "judge-qwen4b",
    "model": "ollama/qwen3:4b",
    "rubric_version": "1",
    "thinking": "off"
  },
  "metrics": {
    "concision": "left",
    "coverage": "right",
    "fidelity": "tie"
  },
  "overall_preference": "tie",
  "rationale": "Response A has better coverage (includes lean startup origin, project stages, and amorphous blob concept) while Response B is more concise but misses key claims like lean startup methodology and specific project stages. Both maintain fidelity without hallucinations.",
  "raw_output_ref": "judgments/judge-qwen4b/transcript-summary-ollama-nemotron-3-nano-4b-high-summarizer-r1__transcript-summary-claude-cli-haiku-high-summarizer-r1.artifacts",
  "recorded_at": "2026-08-04T16:31:12Z",
  "schema_version": 2,
  "type": "judge_verdict"
}
