{
  "comparison": {
    "blinding_seed": 63027443824879,
    "left": "transcript-summary-claude-cli-haiku-off-summarizer-r1",
    "presented_order": [
      "right",
      "left"
    ],
    "right": "transcript-summary-claude-cli-haiku-high-summarizer-r1"
  },
  "invalid": false,
  "judge": {
    "id": "judge-nemotron",
    "model": "ollama/nemotron-3-nano:4b",
    "rubric_version": "1",
    "thinking": "off"
  },
  "metrics": {
    "concision": "tie",
    "coverage": "tie",
    "fidelity": "left"
  },
  "overall_preference": "left",
  "rationale": "Response B maintains factual fidelity by omitting unsupported claims (e.g., file format `.md`) present in Response A, while both responses correctly represent all transcript assertions and are equally concise. Thus overall the stronger candidate is B.",
  "raw_output_ref": "judgments/judge-nemotron/transcript-summary-claude-cli-haiku-off-summarizer-r1__transcript-summary-claude-cli-haiku-high-summarizer-r1.artifacts",
  "recorded_at": "2026-08-04T16:35:28Z",
  "schema_version": 2,
  "type": "judge_verdict"
}
