{
  "comparison": {
    "blinding_seed": 243350992727975,
    "left": "transcript-summary-ollama-qwen3-32b-off-summarizer-r1",
    "presented_order": [
      "right",
      "left"
    ],
    "right": "transcript-summary-claude-cli-haiku-off-summarizer-r1"
  },
  "invalid": false,
  "judge": {
    "id": "judge-nemotron",
    "model": "ollama/nemotron-3-nano:4b",
    "rubric_version": "1",
    "thinking": "off"
  },
  "metrics": {
    "concision": "tie",
    "coverage": "tie",
    "fidelity": "tie"
  },
  "overall_preference": "tie",
  "rationale": "Both responses are free of hallucinations and cover the same core claims, making fidelity a tie. They represent all distinct points from the transcript without omission, resulting in coverage tie. Their prose is similarly tight within the required structure, so concision is also tied. The overall assessment remains equal.",
  "raw_output_ref": "judgments/judge-nemotron/transcript-summary-ollama-qwen3-32b-off-summarizer-r1__transcript-summary-claude-cli-haiku-off-summarizer-r1.artifacts",
  "recorded_at": "2026-08-04T16:33:33Z",
  "schema_version": 2,
  "type": "judge_verdict"
}
