{
  "comparison": {
    "blinding_seed": 158900346327032,
    "left": "transcript-summary-ollama-qwen3-32b-off-summarizer-r1",
    "presented_order": [
      "left",
      "right"
    ],
    "right": "transcript-summary-ollama-qwen3-4b-off-summarizer-r1"
  },
  "invalid": false,
  "judge": {
    "id": "judge-haiku",
    "model": "claude-cli/haiku",
    "rubric_version": "1",
    "thinking": "off"
  },
  "metrics": {
    "concision": "right",
    "coverage": "left",
    "fidelity": "right"
  },
  "overall_preference": "right",
  "rationale": "Response A covers more conceptual ground, including the lifecycle application of personas and considerations around technical depth, making it stronger on coverage. However, it contains a factual hallucination: it changes \"ACMICO\" from the transcript to \"ACME\" in its key points example, introducing a claim unsupported by the source material. Response B is factually accurate throughout, contains no invented details, and presents the core concepts (lean start-up origin, role/biography/organization components, project steering doc function, and human-first philosophy) with tighter, more concise prose. While B misses some nuance about flexibility across the project lifecycle and design tone considerations, its fidelity is flawless. Given the instruction to penalize hallucinations more heavily than missing claims, Response B's accuracy advantage outweighs Response A's more comprehensive coverage.",
  "raw_output_ref": "judgments/judge-haiku/transcript-summary-ollama-qwen3-32b-off-summarizer-r1__transcript-summary-ollama-qwen3-4b-off-summarizer-r1.artifacts",
  "recorded_at": "2026-08-04T16:37:01Z",
  "schema_version": 2,
  "type": "judge_verdict"
}
