{
  "comparison": {
    "blinding_seed": 169160485762664,
    "left": "transcript-summary-ollama-qwen3-4b-off-summarizer-r1",
    "presented_order": [
      "left",
      "right"
    ],
    "right": "transcript-summary-ollama-nemotron-3-nano-4b-off-summarizer-r1"
  },
  "invalid": false,
  "judge": {
    "id": "judge-haiku",
    "model": "claude-cli/haiku",
    "rubric_version": "1",
    "thinking": "off"
  },
  "metrics": {
    "concision": "left",
    "coverage": "right",
    "fidelity": "left"
  },
  "overall_preference": "left",
  "rationale": "Response A maintains strong fidelity with all claims grounded in the transcript and no invented details. Response B has a notable fidelity issue in its summary, where it lists only \"(role, organization)\" when the transcript explicitly includes all three components: role, biography, and organization. Response B also characterizes reviews as \"quick, consistent\" without explicit support in the source. On coverage, Response B performs better by explicitly referencing the agents.md format and more clearly emphasizing the \"every step\" aspect of the development process. However, Response A's tighter prose structure and superior fidelity (especially the incomplete attribute list in B's summary) outweigh the coverage advantage, particularly given the instruction to penalize fidelity issues more heavily than gaps in coverage. Response A also avoids unnecessary wordiness while remaining comprehensive on the core points.",
  "raw_output_ref": "judgments/judge-haiku/transcript-summary-ollama-qwen3-4b-off-summarizer-r1__transcript-summary-ollama-nemotron-3-nano-4b-off-summarizer-r1.artifacts",
  "recorded_at": "2026-08-04T16:42:08Z",
  "schema_version": 2,
  "type": "judge_verdict"
}
