{
  "comparison": {
    "blinding_seed": 94050015123054,
    "left": "transcript-summary-ollama-qwen3-4b-off-summarizer-r1",
    "presented_order": [
      "left",
      "right"
    ],
    "right": "transcript-summary-ollama-qwen3-4b-high-summarizer-r1"
  },
  "invalid": false,
  "judge": {
    "id": "judge-qwen4b",
    "model": "ollama/qwen3:4b",
    "rubric_version": "1",
    "thinking": "off"
  },
  "metrics": {
    "concision": "left",
    "coverage": "right",
    "fidelity": "tie"
  },
  "overall_preference": "right",
  "rationale": "Response B covers the mixing and matching detail from the transcript that A omitted, improving coverage. Both maintain fidelity with no hallucinations. Response A is more concise, but the critical coverage gap favors B.",
  "raw_output_ref": "judgments/judge-qwen4b/transcript-summary-ollama-qwen3-4b-off-summarizer-r1__transcript-summary-ollama-qwen3-4b-high-summarizer-r1.artifacts",
  "recorded_at": "2026-08-04T16:22:46Z",
  "schema_version": 2,
  "type": "judge_verdict"
}
