{
  "comparison": {
    "blinding_seed": 207156331942435,
    "left": "transcript-summary-ollama-qwen3-32b-off-summarizer-r1",
    "presented_order": [
      "right",
      "left"
    ],
    "right": "transcript-summary-ollama-nemotron-3-nano-4b-off-summarizer-r1"
  },
  "invalid": false,
  "judge": {
    "id": "judge-nemotron",
    "model": "ollama/nemotron-3-nano:4b",
    "rubric_version": "1",
    "thinking": "off"
  },
  "metrics": {
    "concision": "tie",
    "coverage": "left",
    "fidelity": "left"
  },
  "overall_preference": "left",
  "rationale": "Response A omits the biography detail present in the transcript while otherwise accurate, leading to weaker coverage and fidelity; Response B incorporates all distinct claims including role, biography, organization, flexibility, and extended purposes, meeting higher fidelity, full coverage, and acceptable concision.",
  "raw_output_ref": "judgments/judge-nemotron/transcript-summary-ollama-qwen3-32b-off-summarizer-r1__transcript-summary-ollama-nemotron-3-nano-4b-off-summarizer-r1.artifacts",
  "recorded_at": "2026-08-04T16:33:27Z",
  "schema_version": 2,
  "type": "judge_verdict"
}
