{
  "comparison": {
    "blinding_seed": 172469894363476,
    "left": "transcript-summary-ollama-qwen3-32b-high-summarizer-r1",
    "presented_order": [
      "left",
      "right"
    ],
    "right": "transcript-summary-claude-cli-haiku-high-summarizer-r1"
  },
  "invalid": true,
  "judge": {
    "id": "judge-haiku",
    "model": "claude-cli/haiku",
    "rubric_version": "1",
    "thinking": "off"
  },
  "metrics": {
    "concision": "tie",
    "coverage": "tie",
    "fidelity": "tie"
  },
  "overall_preference": "tie",
  "rationale": null,
  "raw_output_ref": "judgments/judge-haiku/transcript-summary-ollama-qwen3-32b-high-summarizer-r1__transcript-summary-claude-cli-haiku-high-summarizer-r1.artifacts",
  "recorded_at": "2026-08-04T16:40:29Z",
  "schema_version": 2,
  "type": "judge_verdict"
}
