{
  "comparison": {
    "blinding_seed": 62318933400276,
    "left": "transcript-summary-ollama-qwen3-4b-high-summarizer-r1",
    "presented_order": [
      "left",
      "right"
    ],
    "right": "transcript-summary-claude-cli-haiku-high-summarizer-r1"
  },
  "invalid": false,
  "judge": {
    "id": "judge-nemotron",
    "model": "ollama/nemotron-3-nano:4b",
    "rubric_version": "1",
    "thinking": "off"
  },
  "metrics": {
    "concision": "tie",
    "coverage": "tie",
    "fidelity": "tie"
  },
  "overall_preference": "tie",
  "rationale": "Both responses faithfully represent all claims in the transcript with no hallucinations (fidelity), they capture every distinct claim from the transcript and nothing is omitted (coverage), and both deliver clear, minimal prose without filler or transcribed disfluencies (concision). Hence each candidate performs equally well.",
  "raw_output_ref": "judgments/judge-nemotron/transcript-summary-ollama-qwen3-4b-high-summarizer-r1__transcript-summary-claude-cli-haiku-high-summarizer-r1.artifacts",
  "recorded_at": "2026-08-04T16:34:53Z",
  "schema_version": 2,
  "type": "judge_verdict"
}
