{
  "comparison": {
    "blinding_seed": 86756107275488,
    "left": "transcript-summary-ollama-qwen3-32b-off-summarizer-r1",
    "presented_order": [
      "left",
      "right"
    ],
    "right": "transcript-summary-claude-cli-haiku-off-summarizer-r1"
  },
  "invalid": false,
  "judge": {
    "id": "judge-haiku",
    "model": "claude-cli/haiku",
    "rubric_version": "1",
    "thinking": "off"
  },
  "metrics": {
    "concision": "right",
    "coverage": "right",
    "fidelity": "tie"
  },
  "overall_preference": "right",
  "rationale": "Both responses accurately represent the transcript without hallucination. Response B achieves superior coverage by explicitly stating that personas guide \"every phase: spec writing, planning, and review\"\u2014a point the speaker emphasizes\u2014while Response A vaguely references \"throughout the project lifecycle.\" Response B also more directly invokes the \"amorphous audience\" concept from the source material. On concision, Response B's summary is tighter and more direct (e.g., \"AI Outfitter personas are project steering documents...that help humans and agents understand who they're building for\" is cleaner than Response A's multi-clause approach). While Response B has 8 key points versus Response A's 5, each point is substantive and distinct\u2014not padded filler\u2014and together they capture the transcript's core claims more completely. Response A is competent but slightly verbose and misses explicit coverage of the phased application emphasized in the source.",
  "raw_output_ref": "judgments/judge-haiku/transcript-summary-ollama-qwen3-32b-off-summarizer-r1__transcript-summary-claude-cli-haiku-off-summarizer-r1.artifacts",
  "recorded_at": "2026-08-04T16:38:02Z",
  "schema_version": 2,
  "type": "judge_verdict"
}
