{
  "comparison": {
    "blinding_seed": 250142088632354,
    "left": "transcript-summary-ollama-nemotron-3-nano-4b-off-summarizer-r1",
    "presented_order": [
      "left",
      "right"
    ],
    "right": "transcript-summary-ollama-nemotron-3-nano-4b-high-summarizer-r1"
  },
  "invalid": false,
  "judge": {
    "id": "judge-qwen4b",
    "model": "ollama/qwen3:4b",
    "rubric_version": "1",
    "thinking": "off"
  },
  "metrics": {
    "concision": "right",
    "coverage": "left",
    "fidelity": "tie"
  },
  "overall_preference": "left",
  "rationale": "Response A covers all critical claims including the philosophy of human-first design (explicitly in transcript) while Response B misses this key point. Fidelity is tied as both avoid hallucinations. Coverage is weighted higher per task requirements, making A superior despite B's concision.",
  "raw_output_ref": "judgments/judge-qwen4b/transcript-summary-ollama-nemotron-3-nano-4b-off-summarizer-r1__transcript-summary-ollama-nemotron-3-nano-4b-high-summarizer-r1.artifacts",
  "recorded_at": "2026-08-04T16:29:20Z",
  "schema_version": 2,
  "type": "judge_verdict"
}
