{
  "comparison": {
    "blinding_seed": 36617884044916,
    "left": "transcript-summary-ollama-qwen3-4b-off-summarizer-r1",
    "presented_order": [
      "left",
      "right"
    ],
    "right": "transcript-summary-claude-cli-haiku-off-summarizer-r1"
  },
  "invalid": false,
  "judge": {
    "id": "judge-nemotron",
    "model": "ollama/nemotron-3-nano:4b",
    "rubric_version": "1",
    "thinking": "off"
  },
  "metrics": {
    "concision": "left",
    "coverage": "right",
    "fidelity": "tie"
  },
  "overall_preference": "right",
  "rationale": "Both candidates avoid hallucination and the prose is clean, but Candidate B demonstrates higher factual coverage by explicitly conveying the transcript\u2019s points about flexible role\u2011organization mixing across organizations, and its guidance for every project phase. Candidate A omits that flexibility claim. Overall fidelity ties while coverage favors B and concision slightly prefers A.",
  "raw_output_ref": "judgments/judge-nemotron/transcript-summary-ollama-qwen3-4b-off-summarizer-r1__transcript-summary-claude-cli-haiku-off-summarizer-r1.artifacts",
  "recorded_at": "2026-08-04T16:34:32Z",
  "schema_version": 2,
  "type": "judge_verdict"
}
