{
  "comparison": {
    "blinding_seed": 199068261409955,
    "left": "transcript-summary-ollama-nemotron-3-nano-4b-off-summarizer-r1",
    "presented_order": [
      "right",
      "left"
    ],
    "right": "transcript-summary-claude-cli-haiku-off-summarizer-r1"
  },
  "invalid": false,
  "judge": {
    "id": "judge-haiku",
    "model": "claude-cli/haiku",
    "rubric_version": "1",
    "thinking": "off"
  },
  "metrics": {
    "concision": "tie",
    "coverage": "right",
    "fidelity": "right"
  },
  "overall_preference": "right",
  "rationale": "Response A maintains strong fidelity with no unsupported claims, while Response B includes a minor interpretive statement ('not merely as UI outfitters') that isn't explicitly in the transcript. On coverage, Response A significantly outperforms by including the lean startup/Lean Canvas reference\u2014an explicit and important contextual claim that Response B omits entirely. Response A also covers additional details like technical tone determination and explicitly mentions the phases of development (specs, planning, review). Both responses demonstrate clean, tight prose with no disfluencies, though Response B's use of formatting adds visual variation without substantially improving readability. Response A's greater completeness and accuracy on core claims make it the stronger summary.",
  "raw_output_ref": "judgments/judge-haiku/transcript-summary-ollama-nemotron-3-nano-4b-off-summarizer-r1__transcript-summary-claude-cli-haiku-off-summarizer-r1.artifacts",
  "recorded_at": "2026-08-04T16:45:59Z",
  "schema_version": 2,
  "type": "judge_verdict"
}
