{
  "comparison": {
    "blinding_seed": 270943092000039,
    "left": "transcript-summary-ollama-nemotron-3-nano-4b-high-summarizer-r1",
    "presented_order": [
      "right",
      "left"
    ],
    "right": "transcript-summary-claude-cli-haiku-high-summarizer-r1"
  },
  "invalid": false,
  "judge": {
    "id": "judge-haiku",
    "model": "claude-cli/haiku",
    "rubric_version": "1",
    "thinking": "off"
  },
  "metrics": {
    "concision": "right",
    "coverage": "right",
    "fidelity": "tie"
  },
  "overall_preference": "right",
  "rationale": "Both responses avoid hallucinations and are factually grounded in the transcript. Response A captures significantly more of the transcript's distinct claims, including the lean startup methodology origin, the design-for-humans-first philosophy, the distinction between engineer and finance audiences, and the 'amorphous blob' contrast. Response B omits these contextual claims, covering only the structural elements (role, biography, organization) and basic function. While Response B is slightly more concise (4 key points vs. 8), this brevity comes at a substantial cost to coverage\u2014the speaker explicitly discusses the philosophical motivation and lean startup connection, which Response B entirely misses. Response A achieves tight, clean prose without sacrificing the distinct claims the transcript emphasizes; its key points each add distinct value rather than repeating the same concept. Given the instruction to prioritize coverage of 'distinct claims' and the metric definition of representing 'important points,' Response A's more comprehensive treatment better fulfills the task requirements.",
  "raw_output_ref": "judgments/judge-haiku/transcript-summary-ollama-nemotron-3-nano-4b-high-summarizer-r1__transcript-summary-claude-cli-haiku-high-summarizer-r1.artifacts",
  "recorded_at": "2026-08-04T16:46:24Z",
  "schema_version": 2,
  "type": "judge_verdict"
}
