{
  "comparison": {
    "blinding_seed": 243275612314170,
    "left": "transcript-summary-ollama-nemotron-3-nano-4b-off-summarizer-r1",
    "presented_order": [
      "left",
      "right"
    ],
    "right": "transcript-summary-claude-cli-haiku-off-summarizer-r1"
  },
  "invalid": false,
  "judge": {
    "id": "judge-nemotron",
    "model": "ollama/nemotron-3-nano:4b",
    "rubric_version": "1",
    "thinking": "off"
  },
  "metrics": {
    "concision": "left",
    "coverage": "tie",
    "fidelity": "tie"
  },
  "overall_preference": "tie",
  "rationale": "Both responses accurately reflect the transcript without adding facts, cover the essential points of a persona's role as a project\u2011steering document, but Response A is slightly more concise.",
  "raw_output_ref": "judgments/judge-nemotron/transcript-summary-ollama-nemotron-3-nano-4b-off-summarizer-r1__transcript-summary-claude-cli-haiku-off-summarizer-r1.artifacts",
  "recorded_at": "2026-08-04T16:35:08Z",
  "schema_version": 2,
  "type": "judge_verdict"
}
